<?xml version="1.0" encoding="UTF-8"?>
<Persons xmlns:xsi="http://www.w3.org/2001/XMLSchema-instance"
 xsi:noNamespaceSchemaLocation="file:./Persons.xsd">
    <Person>
        <PersonId>50</PersonId>
        <Lastname>Luyet</Lastname>
        <Firstname>Gil</Firstname>
        <Username>luyetg</Username>
        <Password>123</Password>
        <Engagments>
            <Engagment>
                <EngagementId>1</EngagementId>
                <Role>Student</Role>
                <CoursRef>4112</CoursRef>
                <Grade>
                    <ProjectGrades>
                        <Step>
                            <StepNo>75</StepNo>
                            <StepGrade>5</StepGrade>
                        </Step>
                        <Step>
                            <StepNo>25</StepNo>
                            <StepGrade>4</StepGrade>
                        </Step>
                    </ProjectGrades>
                    <ExamGrade>6</ExamGrade>
                </Grade>
            </Engagment>
            <Engagment>
                <EngagementId>2</EngagementId>
                <Role>Tutor</Role>
                <CoursRef>4112</CoursRef>
            </Engagment>
        </Engagments>
        <ToDoList/>
    </Person>
    <Person>
        <PersonId>51</PersonId>
        <Lastname>Carnevale</Lastname>
        <Firstname>Luca</Firstname>
        <Username>carnevlu</Username>
        <Password>123</Password>
        <Engagments>
            <Engagment>
                <EngagementId>3</EngagementId>
                <Role>Tutor</Role>
                <CoursRef>4112</CoursRef>
            </Engagment>
        </Engagments>
        <ToDoList>
            <Activity>
                <Title>Title6</Title>
                <Tasks>
                    <Task>
                        <Title>Title7</Title>
                        <Description>
                            <List>
                                <SubList>
                                    <SubListItem>
                                        <Link>
                                            <LinkText>LinkText12</LinkText>
                                            <LinkRef>http://www.oxygenxml.com/</LinkRef>
                                        </Link>
                                        <Fragment>Fragment14</Fragment>
                                    </SubListItem>
                                    <SubListItem>
                                        <Link>
                                            <LinkText>LinkText13</LinkText>
                                            <LinkRef>http://www.oxygenxml.com/</LinkRef>
                                        </Link>
                                        <Link>
                                            <LinkText>LinkText14</LinkText>
                                            <LinkRef>http://www.oxygenxml.com/</LinkRef>
                                        </Link>
                                    </SubListItem>
                                </SubList>
                                <SubList>
                                    <SubListItem>
                                        <Link>
                                            <LinkText>LinkText15</LinkText>
                                            <LinkRef>http://www.oxygenxml.com/</LinkRef>
                                        </Link>
                                        <Link>
                                            <LinkText>LinkText16</LinkText>
                                            <LinkRef>http://www.oxygenxml.com/</LinkRef>
                                        </Link>
                                    </SubListItem>
                                    <SubListItem>
                                        <Fragment>Fragment15</Fragment>
                                        <Link>
                                            <LinkText>LinkText17</LinkText>
                                            <LinkRef>http://www.oxygenxml.com/</LinkRef>
                                        </Link>
                                    </SubListItem>
                                </SubList>
                            </List>
                            <List>
                                <SubList>
                                    <SubListItem>
                                        <Fragment>Fragment16</Fragment>
                                        <Fragment>Fragment17</Fragment>
                                    </SubListItem>
                                    <SubListItem>
                                        <Link>
                                            <LinkText>LinkText18</LinkText>
                                            <LinkRef>http://www.oxygenxml.com/</LinkRef>
                                        </Link>
                                        <Link>
                                            <LinkText>LinkText19</LinkText>
                                            <LinkRef>http://www.oxygenxml.com/</LinkRef>
                                        </Link>
                                    </SubListItem>
                                </SubList>
                                <SubList>
                                    <SubListItem>
                                        <Fragment>Fragment18</Fragment>
                                        <Link>
                                            <LinkText>LinkText20</LinkText>
                                            <LinkRef>http://www.oxygenxml.com/</LinkRef>
                                        </Link>
                                    </SubListItem>
                                    <SubListItem>
                                        <Link>
                                            <LinkText>LinkText21</LinkText>
                                            <LinkRef>http://www.oxygenxml.com/</LinkRef>
                                        </Link>
                                        <Fragment>Fragment19</Fragment>
                                    </SubListItem>
                                </SubList>
                            </List>
                        </Description>
                        <Priority>2</Priority>
                    </Task>
                    <Task>
                        <Title>Title8</Title>
                        <Description>
                            <List>
                                <ListItem>
                                    <Link>
                                        <LinkText>LinkText22</LinkText>
                                        <LinkRef>http://www.oxygenxml.com/</LinkRef>
                                    </Link>
                                    <Fragment>Fragment20</Fragment>
                                </ListItem>
                                <ListItem>
                                    <Fragment>Fragment21</Fragment>
                                    <Fragment>Fragment22</Fragment>
                                </ListItem>
                            </List>
                            <List>
                                <ListItem>
                                    <Fragment>Fragment23</Fragment>
                                    <Link>
                                        <LinkText>LinkText23</LinkText>
                                        <LinkRef>http://www.oxygenxml.com/</LinkRef>
                                    </Link>
                                </ListItem>
                                <ListItem>
                                    <Link>
                                        <LinkText>LinkText24</LinkText>
                                        <LinkRef>http://www.oxygenxml.com/</LinkRef>
                                    </Link>
                                    <Link>
                                        <LinkText>LinkText25</LinkText>
                                        <LinkRef>http://www.oxygenxml.com/</LinkRef>
                                    </Link>
                                </ListItem>
                            </List>
                        </Description>
                        <Priority>2</Priority>
                    </Task>
                </Tasks>
            </Activity>
            <Activity>
                <Title>Title9</Title>
                <Tasks>
                    <Task>
                        <Title>Title10</Title>
                        <Description>
                            <Parag>
                                <Link>
                                    <LinkText>LinkText26</LinkText>
                                    <LinkRef>http://www.oxygenxml.com/</LinkRef>
                                </Link>
                                <Fragment>Fragment24</Fragment>
                            </Parag>
                            <Parag>
                                <Link>
                                    <LinkText>LinkText27</LinkText>
                                    <LinkRef>http://www.oxygenxml.com/</LinkRef>
                                </Link>
                                <Fragment>Fragment25</Fragment>
                            </Parag>
                        </Description>
                        <Priority>2</Priority>
                    </Task>
                    <Task>
                        <Title>Title11</Title>
                        <Description>
                            <List>
                                <ListItem>
                                    <Fragment>Fragment26</Fragment>
                                    <Fragment>Fragment27</Fragment>
                                </ListItem>
                                <ListItem>
                                    <Fragment>Fragment28</Fragment>
                                    <Link>
                                        <LinkText>LinkText28</LinkText>